{
  "$schema": "../schemas/world.schema.json",
  "content": "../gameplay/faction-trial-content.json",
  "rules": "../gameplay/gameplay-rules.json",
  "appearance": "../presentation/scene-appearance.json",
  "effects": "../presentation/combat-effects.json",
  "match": {
    "player": "virus",
    "opponent": "immune",
    "starts": [
      {
        "faction": "virus",
        "cell": 0
      },
      {
        "faction": "immune",
        "cell": 1
      }
    ],
    "auto_colonize": true
  },
  "bodies": [
    {
      "type": "unclaimed",
      "owner": "neutral",
      "position": [
        -52.0,
        -4.0,
        0.0
      ],
      "radius": 4.2,
      "tint": [
        1.0,
        1.0,
        1.0
      ],
      "site": {
        "availability": 1.0,
        "normal": [
          0.0,
          0.29,
          0.957
        ]
      },
      "medium": {
        "radius_fraction": 0.94,
        "edge_fade": 0.28,
        "scattering": [
          0.1,
          0.075,
          0.085
        ],
        "absorption": 0.018,
        "anisotropy": 0.2,
        "depth_blur": {
          "start_fraction": 0.3333333333333333,
          "full_fraction": 0.6666666666666666,
          "max_radius": 18
        }
      },
      "seed": 44346
    },
    {
      "type": "unclaimed",
      "owner": "neutral",
      "position": [
        48.0,
        14.0,
        0.0
      ],
      "radius": 4.2,
      "tint": [
        1.0,
        1.0,
        1.0
      ],
      "site": {
        "availability": 1.0,
        "normal": [
          0.0,
          0.29,
          0.957
        ]
      },
      "medium": {
        "radius_fraction": 0.94,
        "edge_fade": 0.28,
        "scattering": [
          0.1,
          0.075,
          0.085
        ],
        "absorption": 0.018,
        "anisotropy": 0.2,
        "depth_blur": {
          "start_fraction": 0.3333333333333333,
          "full_fraction": 0.6666666666666666,
          "max_radius": 18
        }
      },
      "seed": 51737
    },
    {
      "type": "unclaimed",
      "owner": "neutral",
      "position": [
        -30.0,
        0.0,
        0.0
      ],
      "radius": 2.1,
      "tint": [
        1.0,
        1.0,
        1.0
      ],
      "site": {
        "availability": 0.75,
        "normal": [
          0.0,
          0.29,
          0.957
        ]
      },
      "medium": {
        "radius_fraction": 0.94,
        "edge_fade": 0.28,
        "scattering": [
          0.1,
          0.075,
          0.085
        ],
        "absorption": 0.018,
        "anisotropy": 0.2,
        "depth_blur": {
          "start_fraction": 0.3333333333333333,
          "full_fraction": 0.6666666666666666,
          "max_radius": 18
        }
      },
      "seed": 59128
    },
    {
      "type": "unclaimed",
      "owner": "neutral",
      "position": [
        -3.0,
        -6.0,
        0.0
      ],
      "radius": 2.7,
      "tint": [
        1.0,
        1.0,
        1.0
      ],
      "site": {
        "availability": 1.0,
        "normal": [
          0.0,
          0.29,
          0.957
        ]
      },
      "medium": {
        "radius_fraction": 0.94,
        "edge_fade": 0.28,
        "scattering": [
          0.1,
          0.075,
          0.085
        ],
        "absorption": 0.018,
        "anisotropy": 0.2,
        "depth_blur": {
          "start_fraction": 0.3333333333333333,
          "full_fraction": 0.6666666666666666,
          "max_radius": 18
        }
      },
      "seed": 66519
    },
    {
      "type": "unclaimed",
      "owner": "neutral",
      "position": [
        24.0,
        9.0,
        0.0
      ],
      "radius": 2.1,
      "tint": [
        1.0,
        1.0,
        1.0
      ],
      "site": {
        "availability": 0.75,
        "normal": [
          0.0,
          0.29,
          0.957
        ]
      },
      "medium": {
        "radius_fraction": 0.94,
        "edge_fade": 0.28,
        "scattering": [
          0.1,
          0.075,
          0.085
        ],
        "absorption": 0.018,
        "anisotropy": 0.2,
        "depth_blur": {
          "start_fraction": 0.3333333333333333,
          "full_fraction": 0.6666666666666666,
          "max_radius": 18
        }
      },
      "seed": 73910
    }
  ],
  "spawns": [
    {
      "type": "swarm_bomber",
      "position": [
        -54.6,
        1.5,
        5.0
      ]
    },
    {
      "type": "swarm_fighter",
      "position": [
        -53.3,
        1.5,
        5.0
      ]
    },
    {
      "type": "swarm_fighter",
      "position": [
        -52.0,
        1.5,
        5.0
      ]
    },
    {
      "type": "swarm_fighter",
      "position": [
        -50.7,
        1.5,
        5.0
      ]
    },
    {
      "type": "swarm_fighter",
      "position": [
        -49.4,
        1.5,
        5.0
      ]
    },
    {
      "type": "immune_bomber",
      "position": [
        45.4,
        19.5,
        5.0
      ]
    },
    {
      "type": "immune_fighter",
      "position": [
        46.7,
        19.5,
        5.0
      ]
    },
    {
      "type": "immune_fighter",
      "position": [
        48.0,
        19.5,
        5.0
      ]
    }
  ]
}
