{
  "$schema": "../schemas/world.schema.json",
  "content": "../gameplay/gameplay.json",
  "rules": "../gameplay/gameplay-rules.json",
  "appearance": "../presentation/scene.json",
  "effects": "../presentation/combat-effects.json",
  "match": {
    "player": "virus",
    "opponent": "immune",
    "starts": [
      {
        "faction": "virus",
        "cell": 0
      },
      {
        "faction": "immune",
        "cell": 5
      },
      {
        "faction": "fungus",
        "cell": 10
      }
    ],
    "auto_colonize": true
  },
  "bodies": [
    {
      "type": "unclaimed",
      "owner": "neutral",
      "position": [-80, -46, 0],
      "radius": 4.2,
      "tint": [1.0, 1.0, 1.0],
      "site": {
        "availability": 1.0,
        "normal": [0.0, 0.29, 0.957]
      },
      "medium": {
        "radius_fraction": 0.94,
        "edge_fade": 0.28,
        "scattering": [0.1, 0.075, 0.085],
        "absorption": 0.018,
        "anisotropy": 0.2,
        "depth_blur": {
          "start_fraction": 0.3333333333333333,
          "full_fraction": 0.6666666666666666,
          "max_radius": 18
        }
      }
    },
    {
      "type": "unclaimed",
      "owner": "neutral",
      "position": [-95, -34, 0],
      "radius": 2.7,
      "tint": [1.0, 1.0, 1.0],
      "site": {
        "availability": 1.0,
        "normal": [0.0, 0.29, 0.957]
      },
      "medium": {
        "radius_fraction": 0.94,
        "edge_fade": 0.28,
        "scattering": [0.1, 0.075, 0.085],
        "absorption": 0.018,
        "anisotropy": 0.2,
        "depth_blur": {
          "start_fraction": 0.3333333333333333,
          "full_fraction": 0.6666666666666666,
          "max_radius": 18
        }
      }
    },
    {
      "type": "unclaimed",
      "owner": "neutral",
      "position": [-65, -34, 0],
      "radius": 2.7,
      "tint": [1.0, 1.0, 1.0],
      "site": {
        "availability": 1.0,
        "normal": [0.0, 0.29, 0.957]
      },
      "medium": {
        "radius_fraction": 0.94,
        "edge_fade": 0.28,
        "scattering": [0.1, 0.075, 0.085],
        "absorption": 0.018,
        "anisotropy": 0.2,
        "depth_blur": {
          "start_fraction": 0.3333333333333333,
          "full_fraction": 0.6666666666666666,
          "max_radius": 18
        }
      }
    },
    {
      "type": "unclaimed",
      "owner": "neutral",
      "position": [-90, -16, 0],
      "radius": 2.1,
      "tint": [1.0, 1.0, 1.0],
      "site": {
        "availability": 1.0,
        "normal": [0.0, 0.29, 0.957]
      },
      "medium": {
        "radius_fraction": 0.94,
        "edge_fade": 0.28,
        "scattering": [0.1, 0.075, 0.085],
        "absorption": 0.018,
        "anisotropy": 0.2,
        "depth_blur": {
          "start_fraction": 0.3333333333333333,
          "full_fraction": 0.6666666666666666,
          "max_radius": 18
        }
      }
    },
    {
      "type": "unclaimed",
      "owner": "neutral",
      "position": [-70, -16, 0],
      "radius": 2.1,
      "tint": [1.0, 1.0, 1.0],
      "site": {
        "availability": 1.0,
        "normal": [0.0, 0.29, 0.957]
      },
      "medium": {
        "radius_fraction": 0.94,
        "edge_fade": 0.28,
        "scattering": [0.1, 0.075, 0.085],
        "absorption": 0.018,
        "anisotropy": 0.2,
        "depth_blur": {
          "start_fraction": 0.3333333333333333,
          "full_fraction": 0.6666666666666666,
          "max_radius": 18
        }
      }
    },
    {
      "type": "unclaimed",
      "owner": "neutral",
      "position": [80, -46, 0],
      "radius": 4.2,
      "tint": [1.0, 1.0, 1.0],
      "site": {
        "availability": 1.0,
        "normal": [0.0, 0.29, 0.957]
      },
      "medium": {
        "radius_fraction": 0.94,
        "edge_fade": 0.28,
        "scattering": [0.1, 0.075, 0.085],
        "absorption": 0.018,
        "anisotropy": 0.2,
        "depth_blur": {
          "start_fraction": 0.3333333333333333,
          "full_fraction": 0.6666666666666666,
          "max_radius": 18
        }
      }
    },
    {
      "type": "unclaimed",
      "owner": "neutral",
      "position": [65, -34, 0],
      "radius": 2.7,
      "tint": [1.0, 1.0, 1.0],
      "site": {
        "availability": 1.0,
        "normal": [0.0, 0.29, 0.957]
      },
      "medium": {
        "radius_fraction": 0.94,
        "edge_fade": 0.28,
        "scattering": [0.1, 0.075, 0.085],
        "absorption": 0.018,
        "anisotropy": 0.2,
        "depth_blur": {
          "start_fraction": 0.3333333333333333,
          "full_fraction": 0.6666666666666666,
          "max_radius": 18
        }
      }
    },
    {
      "type": "unclaimed",
      "owner": "neutral",
      "position": [95, -34, 0],
      "radius": 2.7,
      "tint": [1.0, 1.0, 1.0],
      "site": {
        "availability": 1.0,
        "normal": [0.0, 0.29, 0.957]
      },
      "medium": {
        "radius_fraction": 0.94,
        "edge_fade": 0.28,
        "scattering": [0.1, 0.075, 0.085],
        "absorption": 0.018,
        "anisotropy": 0.2,
        "depth_blur": {
          "start_fraction": 0.3333333333333333,
          "full_fraction": 0.6666666666666666,
          "max_radius": 18
        }
      }
    },
    {
      "type": "unclaimed",
      "owner": "neutral",
      "position": [70, -16, 0],
      "radius": 2.1,
      "tint": [1.0, 1.0, 1.0],
      "site": {
        "availability": 1.0,
        "normal": [0.0, 0.29, 0.957]
      },
      "medium": {
        "radius_fraction": 0.94,
        "edge_fade": 0.28,
        "scattering": [0.1, 0.075, 0.085],
        "absorption": 0.018,
        "anisotropy": 0.2,
        "depth_blur": {
          "start_fraction": 0.3333333333333333,
          "full_fraction": 0.6666666666666666,
          "max_radius": 18
        }
      }
    },
    {
      "type": "unclaimed",
      "owner": "neutral",
      "position": [90, -16, 0],
      "radius": 2.1,
      "tint": [1.0, 1.0, 1.0],
      "site": {
        "availability": 1.0,
        "normal": [0.0, 0.29, 0.957]
      },
      "medium": {
        "radius_fraction": 0.94,
        "edge_fade": 0.28,
        "scattering": [0.1, 0.075, 0.085],
        "absorption": 0.018,
        "anisotropy": 0.2,
        "depth_blur": {
          "start_fraction": 0.3333333333333333,
          "full_fraction": 0.6666666666666666,
          "max_radius": 18
        }
      }
    },
    {
      "type": "unclaimed",
      "owner": "neutral",
      "position": [0, 92, 0],
      "radius": 4.2,
      "tint": [1.0, 1.0, 1.0],
      "site": {
        "availability": 1.0,
        "normal": [0.0, 0.29, 0.957]
      },
      "medium": {
        "radius_fraction": 0.94,
        "edge_fade": 0.28,
        "scattering": [0.1, 0.075, 0.085],
        "absorption": 0.018,
        "anisotropy": 0.2,
        "depth_blur": {
          "start_fraction": 0.3333333333333333,
          "full_fraction": 0.6666666666666666,
          "max_radius": 18
        }
      }
    },
    {
      "type": "unclaimed",
      "owner": "neutral",
      "position": [-15, 104, 0],
      "radius": 2.7,
      "tint": [1.0, 1.0, 1.0],
      "site": {
        "availability": 1.0,
        "normal": [0.0, 0.29, 0.957]
      },
      "medium": {
        "radius_fraction": 0.94,
        "edge_fade": 0.28,
        "scattering": [0.1, 0.075, 0.085],
        "absorption": 0.018,
        "anisotropy": 0.2,
        "depth_blur": {
          "start_fraction": 0.3333333333333333,
          "full_fraction": 0.6666666666666666,
          "max_radius": 18
        }
      }
    },
    {
      "type": "unclaimed",
      "owner": "neutral",
      "position": [15, 104, 0],
      "radius": 2.7,
      "tint": [1.0, 1.0, 1.0],
      "site": {
        "availability": 1.0,
        "normal": [0.0, 0.29, 0.957]
      },
      "medium": {
        "radius_fraction": 0.94,
        "edge_fade": 0.28,
        "scattering": [0.1, 0.075, 0.085],
        "absorption": 0.018,
        "anisotropy": 0.2,
        "depth_blur": {
          "start_fraction": 0.3333333333333333,
          "full_fraction": 0.6666666666666666,
          "max_radius": 18
        }
      }
    },
    {
      "type": "unclaimed",
      "owner": "neutral",
      "position": [-10, 122, 0],
      "radius": 2.1,
      "tint": [1.0, 1.0, 1.0],
      "site": {
        "availability": 1.0,
        "normal": [0.0, 0.29, 0.957]
      },
      "medium": {
        "radius_fraction": 0.94,
        "edge_fade": 0.28,
        "scattering": [0.1, 0.075, 0.085],
        "absorption": 0.018,
        "anisotropy": 0.2,
        "depth_blur": {
          "start_fraction": 0.3333333333333333,
          "full_fraction": 0.6666666666666666,
          "max_radius": 18
        }
      }
    },
    {
      "type": "unclaimed",
      "owner": "neutral",
      "position": [10, 122, 0],
      "radius": 2.1,
      "tint": [1.0, 1.0, 1.0],
      "site": {
        "availability": 1.0,
        "normal": [0.0, 0.29, 0.957]
      },
      "medium": {
        "radius_fraction": 0.94,
        "edge_fade": 0.28,
        "scattering": [0.1, 0.075, 0.085],
        "absorption": 0.018,
        "anisotropy": 0.2,
        "depth_blur": {
          "start_fraction": 0.3333333333333333,
          "full_fraction": 0.6666666666666666,
          "max_radius": 18
        }
      }
    }
  ],
  "spawns": [
    {
      "type": "virus_fighter",
      "position": [-80, -46, 7]
    },
    {
      "type": "immune_fighter",
      "position": [80, -46, 7]
    },
    {
      "type": "fungal_spore",
      "position": [0, 92, 7]
    }
  ]
}
