{
  "$schema": "../schemas/world.schema.json",
  "content": "../gameplay/gameplay.json",
  "rules": "../gameplay/gameplay-rules.json",
  "appearance": "../presentation/scene.json",
  "effects": "../presentation/combat-effects.json",
  "match": {
    "player": "immune",
    "opponent": "virus",
    "starts": [{"faction": "virus", "cell": 0}, {"faction": "immune", "cell": 1}],
    "auto_colonize": true
  },
  "bodies": [
    {
      "type": "unclaimed",
      "owner": "neutral",
      "position": [-52.0, -4.0, 0.0],
      "radius": 4.2,
      "tint": [1.0, 1.0, 1.0],
      "site": {
        "availability": 1.0,
        "normal": [0.0, 0.29, 0.957]
      },
      "medium": {
        "radius_fraction": 0.94,
        "edge_fade": 0.28,
        "scattering": [0.1, 0.075, 0.085],
        "absorption": 0.018,
        "anisotropy": 0.2,
        "depth_blur": {
          "start_fraction": 0.3333333333333333,
          "full_fraction": 0.6666666666666666,
          "max_radius": 18
        }
      }
    },
    {
      "type": "unclaimed",
      "owner": "neutral",
      "position": [48.0, 14.0, 0.0],
      "radius": 4.2,
      "tint": [1.0, 1.0, 1.0],
      "site": {
        "availability": 1.0,
        "normal": [0.0, 0.29, 0.957]
      },
      "medium": {
        "radius_fraction": 0.94,
        "edge_fade": 0.28,
        "scattering": [0.1, 0.075, 0.085],
        "absorption": 0.018,
        "anisotropy": 0.2,
        "depth_blur": {
          "start_fraction": 0.3333333333333333,
          "full_fraction": 0.6666666666666666,
          "max_radius": 18
        }
      }
    },
    {
      "type": "unclaimed",
      "owner": "neutral",
      "position": [-30.0, 0.0, 0.0],
      "radius": 2.1,
      "tint": [1.0, 1.0, 1.0],
      "site": {
        "availability": 0.75,
        "normal": [0.0, 0.29, 0.957]
      },
      "medium": {
        "radius_fraction": 0.94,
        "edge_fade": 0.28,
        "scattering": [0.1, 0.075, 0.085],
        "absorption": 0.018,
        "anisotropy": 0.2,
        "depth_blur": {
          "start_fraction": 0.3333333333333333,
          "full_fraction": 0.6666666666666666,
          "max_radius": 18
        }
      }
    },
    {
      "type": "unclaimed",
      "owner": "neutral",
      "position": [-3.0, -6.0, 0.0],
      "radius": 2.7,
      "tint": [1.0, 1.0, 1.0],
      "site": {
        "availability": 1.0,
        "normal": [0.0, 0.29, 0.957]
      },
      "medium": {
        "radius_fraction": 0.94,
        "edge_fade": 0.28,
        "scattering": [0.1, 0.075, 0.085],
        "absorption": 0.018,
        "anisotropy": 0.2,
        "depth_blur": {
          "start_fraction": 0.3333333333333333,
          "full_fraction": 0.6666666666666666,
          "max_radius": 18
        }
      }
    },
    {
      "type": "unclaimed",
      "owner": "neutral",
      "position": [24.0, 9.0, 0.0],
      "radius": 2.1,
      "tint": [1.0, 1.0, 1.0],
      "site": {
        "availability": 0.75,
        "normal": [0.0, 0.29, 0.957]
      },
      "medium": {
        "radius_fraction": 0.94,
        "edge_fade": 0.28,
        "scattering": [0.1, 0.075, 0.085],
        "absorption": 0.018,
        "anisotropy": 0.2,
        "depth_blur": {
          "start_fraction": 0.3333333333333333,
          "full_fraction": 0.6666666666666666,
          "max_radius": 18
        }
      }
    }
  ],
  "spawns": [
    {
      "type": "virus_bomber",
      "position": [-52.0, -1.2, 6.4]
    },
    {
      "type": "immune_bomber",
      "position": [48.0, 16.8, 6.4]
    },
    {
      "type": "virus_fighter",
      "position": [-52.85, -2.4, 6.4]
    },
    {
      "type": "virus_fighter",
      "position": [-52.0, -2.4, 6.4]
    },
    {
      "type": "virus_fighter",
      "position": [-51.15, -2.4, 6.4]
    },
    {
      "type": "immune_fighter",
      "position": [47.15, 15.6, 6.4]
    },
    {
      "type": "immune_fighter",
      "position": [48.0, 15.6, 6.4]
    },
    {
      "type": "immune_fighter",
      "position": [48.85, 15.6, 6.4]
    },
    {
      "type": "immune_fighter",
      "position": [47.15, 16.3, 6.4]
    },
    {
      "type": "immune_fighter",
      "position": [48.0, 16.3, 6.4]
    },
    {
      "type": "immune_fighter",
      "position": [48.85, 16.3, 6.4]
    }
  ]
}
