{
  "$schema": "../schemas/world.schema.json",
  "content": "../gameplay/faction-trials.json",
  "rules": "../gameplay/rules.json",
  "appearance": "../presentation/biology.json",
  "effects": "../presentation/combat.json",
  "match": {
    "player": "fungus",
    "opponent": "virus",
    "starts": [
      {
        "faction": "fungus",
        "cell": 0
      },
      {
        "faction": "virus",
        "cell": 1
      }
    ]
  },
  "bodies": [
    {
      "type": "unclaimed",
      "owner": "neutral",
      "position": [
        -52.0,
        -4.0,
        0.0
      ],
      "radius": 4.2,
      "tint": [
        1.0,
        1.0,
        1.0
      ],
      "site": {
        "availability": 1.0,
        "normal": [
          0.0,
          0.29,
          0.957
        ]
      },
      "medium": {
        "radius_fraction": 0.94,
        "edge_fade": 0.28,
        "scattering": [
          0.1,
          0.075,
          0.085
        ],
        "absorption": 0.018,
        "anisotropy": 0.2,
        "depth_blur": {
          "pixels_per_unit": 3,
          "sharp_distance": 0.6,
          "max_radius": 18
        }
      },
      "seed": 51737
    },
    {
      "type": "unclaimed",
      "owner": "neutral",
      "position": [
        48.0,
        14.0,
        0.0
      ],
      "radius": 4.2,
      "tint": [
        1.0,
        1.0,
        1.0
      ],
      "site": {
        "availability": 1.0,
        "normal": [
          0.0,
          0.29,
          0.957
        ]
      },
      "medium": {
        "radius_fraction": 0.94,
        "edge_fade": 0.28,
        "scattering": [
          0.1,
          0.075,
          0.085
        ],
        "absorption": 0.018,
        "anisotropy": 0.2,
        "depth_blur": {
          "pixels_per_unit": 3,
          "sharp_distance": 0.6,
          "max_radius": 18
        }
      },
      "seed": 59128
    },
    {
      "type": "unclaimed",
      "owner": "neutral",
      "position": [
        -30.0,
        0.0,
        0.0
      ],
      "radius": 2.1,
      "tint": [
        1.0,
        1.0,
        1.0
      ],
      "site": {
        "availability": 0.75,
        "normal": [
          0.0,
          0.29,
          0.957
        ]
      },
      "medium": {
        "radius_fraction": 0.94,
        "edge_fade": 0.28,
        "scattering": [
          0.1,
          0.075,
          0.085
        ],
        "absorption": 0.018,
        "anisotropy": 0.2,
        "depth_blur": {
          "pixels_per_unit": 3,
          "sharp_distance": 0.6,
          "max_radius": 18
        }
      },
      "seed": 66519
    },
    {
      "type": "unclaimed",
      "owner": "neutral",
      "position": [
        -3.0,
        -6.0,
        0.0
      ],
      "radius": 2.7,
      "tint": [
        1.0,
        1.0,
        1.0
      ],
      "site": {
        "availability": 1.0,
        "normal": [
          0.0,
          0.29,
          0.957
        ]
      },
      "medium": {
        "radius_fraction": 0.94,
        "edge_fade": 0.28,
        "scattering": [
          0.1,
          0.075,
          0.085
        ],
        "absorption": 0.018,
        "anisotropy": 0.2,
        "depth_blur": {
          "pixels_per_unit": 3,
          "sharp_distance": 0.6,
          "max_radius": 18
        }
      },
      "seed": 73910
    },
    {
      "type": "unclaimed",
      "owner": "neutral",
      "position": [
        24.0,
        9.0,
        0.0
      ],
      "radius": 2.1,
      "tint": [
        1.0,
        1.0,
        1.0
      ],
      "site": {
        "availability": 0.75,
        "normal": [
          0.0,
          0.29,
          0.957
        ]
      },
      "medium": {
        "radius_fraction": 0.94,
        "edge_fade": 0.28,
        "scattering": [
          0.1,
          0.075,
          0.085
        ],
        "absorption": 0.018,
        "anisotropy": 0.2,
        "depth_blur": {
          "pixels_per_unit": 3,
          "sharp_distance": 0.6,
          "max_radius": 18
        }
      },
      "seed": 81301
    }
  ],
  "spawns": [
    {
      "type": "fungal_founder",
      "position": [
        -52,
        -1.2,
        6.4
      ]
    },
    {
      "type": "swarm_bomber",
      "position": [
        45.4,
        19.5,
        5.0
      ]
    },
    {
      "type": "swarm_fighter",
      "position": [
        46.7,
        19.5,
        5.0
      ]
    },
    {
      "type": "swarm_fighter",
      "position": [
        48.0,
        19.5,
        5.0
      ]
    },
    {
      "type": "swarm_fighter",
      "position": [
        49.3,
        19.5,
        5.0
      ]
    },
    {
      "type": "swarm_fighter",
      "position": [
        50.6,
        19.5,
        5.0
      ]
    }
  ]
}
